{
  "schema_version": "abc/parser-rq-source-recognition-index/v1",
  "qualification_identity_ref": "sha256:1111111111111111111111111111111111111111111111111111111111111111",
  "corpus_generation_ref": "sha256:69d147a198c2148efe734c3024dcb12b501687406ba169bd757041188aba7e69",
  "policy_hash": "sha256:3333333333333333333333333333333333333333333333333333333333333333",
  "membership_ref": "sha256:5555555555555555555555555555555555555555555555555555555555555555",
  "coordinate_system": "decoded_utf8",
  "status": "ok",
  "expected_work_ids": ["fixture-work"],
  "expected_work_count": 1,
  "record_count": 1,
  "records": [{
    "work_id": "fixture-work",
    "capture_generation_ref": "sha256:2222222222222222222222222222222222222222222222222222222222222222",
    "sha256": "sha256:6666666666666666666666666666666666666666666666666666666666666666",
    "bytes": 512,
    "media_type": "application/json",
    "locator": "records/fixture-work/recognition.json"
  }],
  "errors": []
}
